{
  "$schema": "https://json-schema.org/draft/2020-12/schema",
  "$id": "https://mestre-yoda.dev/schemas/state/transaction-manifest/v1",
  "title": "Mestre Yoda transaction manifest v1",
  "type": "object",
  "additionalProperties": false,
  "required": [
    "contractVersion",
    "stateContract",
    "transactionId",
    "planDigest",
    "createdAt",
    "operations"
  ],
  "properties": {
    "contractVersion": { "const": "1.0.0" },
    "stateContract": { "const": "1.0.0" },
    "transactionId": { "$ref": "#/$defs/id" },
    "planDigest": { "$ref": "#/$defs/sha256" },
    "createdAt": { "$ref": "#/$defs/timestamp" },
    "operations": {
      "type": "array",
      "minItems": 1,
      "items": { "$ref": "#/$defs/operation" }
    }
  },
  "$defs": {
    "id": {
      "type": "string",
      "pattern": "^[a-zA-Z0-9][a-zA-Z0-9._:-]{0,127}$"
    },
    "sha256": { "type": "string", "pattern": "^[a-f0-9]{64}$" },
    "timestamp": {
      "type": "string",
      "pattern": "^\\d{4}-(?:0[1-9]|1[0-2])-(?:0[1-9]|[12]\\d|3[01])T(?:[01]\\d|2[0-3]):[0-5]\\d:[0-5]\\d(?:\\.\\d{1,9})?Z$"
    },
    "reference": {
      "type": "string",
      "minLength": 1,
      "maxLength": 1024,
      "pattern": "^(?!/)(?![A-Za-z]:[\\\\/])(?!.*\\\\)(?!.*(?:^|/)\\.\\.(?:/|$))(?![a-z][a-z0-9+.-]*://)[^\\u0000-\\u001f\\u007f]+$"
    },
    "safeInteger": {
      "type": "integer",
      "minimum": 0,
      "maximum": 9007199254740991
    },
    "fingerprint": {
      "oneOf": [
        {
          "type": "object",
          "additionalProperties": false,
          "required": ["kind"],
          "properties": { "kind": { "const": "missing" } }
        },
        {
          "type": "object",
          "additionalProperties": false,
          "required": ["kind"],
          "properties": { "kind": { "const": "directory" } }
        },
        {
          "type": "object",
          "additionalProperties": false,
          "required": ["kind", "size", "sha256"],
          "properties": {
            "kind": { "const": "file" },
            "size": { "$ref": "#/$defs/safeInteger" },
            "sha256": { "$ref": "#/$defs/sha256" }
          }
        }
      ]
    },
    "operation": {
      "type": "object",
      "additionalProperties": false,
      "required": [
        "operationId",
        "kind",
        "path",
        "expected",
        "result",
        "stagedPath"
      ],
      "properties": {
        "operationId": { "$ref": "#/$defs/id" },
        "kind": {
          "enum": ["create_directory", "write_file", "delete_file"]
        },
        "path": { "$ref": "#/$defs/reference" },
        "expected": { "$ref": "#/$defs/fingerprint" },
        "result": { "$ref": "#/$defs/fingerprint" },
        "stagedPath": {
          "oneOf": [{ "$ref": "#/$defs/reference" }, { "type": "null" }]
        }
      },
      "allOf": [
        {
          "if": {
            "properties": { "kind": { "const": "write_file" } },
            "required": ["kind"]
          },
          "then": {
            "properties": {
              "stagedPath": { "$ref": "#/$defs/reference" }
            }
          },
          "else": {
            "properties": { "stagedPath": { "type": "null" } }
          }
        }
      ]
    }
  }
}
