{
  "contractVersion": "1.0.0",
  "stateContract": "1.0.0",
  "transactionId": "transaction-01",
  "planDigest": "aaaaaaaaaaaaaaaaaaaaaaaaaaaaaaaaaaaaaaaaaaaaaaaaaaaaaaaaaaaaaaaa",
  "createdAt": "2026-08-09T00:00:00.000Z",
  "operations": [
    {
      "operationId": "operation-0001",
      "kind": "write_file",
      "path": ".brain/state.json",
      "expected": { "kind": "missing" },
      "result": {
        "kind": "file",
        "size": 3,
        "sha256": "aaaaaaaaaaaaaaaaaaaaaaaaaaaaaaaaaaaaaaaaaaaaaaaaaaaaaaaaaaaaaaaa"
      },
      "stagedPath": ".brain/transactions/transaction-01/staging/operation-0001.payload"
    }
  ]
}
